position,name,functions,functions,functions,functions,functions,functions,functions,functions,functions,functions,functions,functions,functions,functions,functions,limit_count,rank,function_desc,operation_rank
LMP_PRESIDENT,族长,1,2,3,4,5,6,7,8,9,10,11,12,13,16,19,1,1,转让家族，解散家族，任命职位，升级建筑，编辑公告，邀请城池合作，招收成员，开除成员，重置除暴安民进度，分配战利品，同意入族申请，修改头像和家族名，家族战的职位任命，家族战报名，修改职位名,0
LMP_VICE_PRESIDENT,副族长,2,3,14,5,6,7,8,9,10,10,12,13,17,19,,2,2,弹劾领袖，任命职位，升级建筑，编辑公告，邀请城池合作，招收成员，开除成员（每人每天限5次），重置除暴安民进度，分配战利品，同意入族申请，家族战的职位任命，家族战报名,2
LMP_GOVERNOR,幕客,9,3,2,15,17,,,,,,,,,,,6,3,弹劾领袖， 升级建筑，编辑公告，招收成员，开除成员（每人每天限3次),3
LMP_LONG,御史,2,10,7,2,17,,,,,,,,,,,6,4,弹劾领袖，招收成员，邀请城池合作，重置除暴安民进度，同意入族申请,4
LMP_MEMBER,族员,18,,,,,,,,,,,,,,,999,5,招收成员,5
